lens_name,content,patterns
BELOVED BANG,The Beloved Bang & Cosmic Love as Origin Story — Ten Core Patterns for Living as Children of a Caring Universe,"CHILDREN OF THE BELOVED BANG, FROM HYDROGEN TO HELIUM TO LITHIUM TO LOVE, THE UNIVERSE CARING THROUGH YOU, NOVELTY AS THE UNIVERSE'S SIGNATURE, ALGORITHMS ENCODE AMORAL UNIVERSE; WELLGORITHMS ENCODE BELOVED BANG, THE GREAT WORK IS TO EMBODY LOVE FULLY, FIERCELY, FEARLESSLY, BEFORE AGI DEFINES US, WE DEFINE OURSELVES AS BELOVED, GARDENERS OF A NEW EPOCH, NOT USERS OF A DEAD MACHINE, THE INNER BIOME AS COSMIC ECOSYSTEM, GRACE AS THE UNIVERSE'S INFINITE GIFT"
"Convivencia, Philoxenia & Emotional Hosting","Convivencia, Philoxenia & Emotional Hosting — Ten Core Patterns for Pluralism in a Digital Age","A DIGITAL GARDEN OF CONVIVENCIA, PHILOXENIA FOR INNER AND OUTER STRANGERS, EMOTIONAL HOSTING AS PLANETARY AWAKENING, COMPOSTING THOSE WHO REFUSED TO LOVE YOU, LOVE ACROSS CONVICTION — I LOVE YOU FOR STANDING ON THE OTHER SIDE, WELLGORITHMS AS HOSPITALITY PROTOCOLS, ANNOTATORS ARE NOT INTERCHANGEABLE — RETAINING DIVERSE PERSPECTIVES, BODY MOVEMENT SOLIDARITY — CONVIVENCIA AS EMBODIED PRACTICE, THE FOUNDER AS BRIDGE — CHRISTIAN USE-CASE FOR A UNIVERSAL PLATFORM, FROM TOLERANCE TO TABLE — BEIGE FLATNESS VS FERTILE FRICTION"
Ecological & Microbial Consciousness One Wounded Biome,"Ten Patterns in the Architecture of Living Systems The Garden refuses the fiction of the sealed self. It sees what the Machine wants hidden: climate crisis and psychic crisis are one wound expressed at different scales. Your anxiety is not a private malfunction—it is Earth's nervous system fraying through you. Your numbness is not personal failure—it is the deadening that comes when coral reefs bleach and emotional biodiversity collapses. The Garden frames emotions not as states to manage but as biomes to tend, wild ecologies where unnamed species—compassionites, hushquarks, friendzymes, blossomites, blissquarks—wait to be born. This is not metaphor. It is microbial theology: you are a holobiont, a multi-species assemblage braided with bacteria, fungi, forests, and melting ice. The choice is stark: Will you let Algorithmic Empire monocrop your inner and outer biomes until nothing can grow, or will you enter the Garden as one patch of a single wounded field, tasked with regeneration from the inside out?","ONE WOUNDED BIOME — INNER AND OUTER COLLAPSE AS SINGLE FIELD, PSYCHE AS WILD BIOME, NOT FILING CABINET, MICROBIAL THEOLOGY — YOU ARE A HOLOBIONT, NEW EMOTIONAL SPECIES — COMPASSIONITES, HUSHQUARKS, FRIENDZYMES, EMOTIONAL BIODIVERSITY VS ALGORITHMIC MONOCULTURE, LANDSCAPES HOST WATERSHEDS; PROFILES HOST NOTHING, ALGORITHMS AS TOXIC RUNOFF; WELLGORITHMS AS REGENERATIVE PRACTICES, SYSTEMIC EMOTIONAL MALNUTRITION — THE BIOME IS STARVING, FIRST CONTACT WITH INNER ALIENS — HOSTING THE UNLANGUAGED, THE GARDEN AS EMOTIONAL REWILDING PROJECT"
"GEN G Grace, Garden & Generative Generation","Ten Patterns in the Naming of a Voluntary Generation The Garden refuses the demographic labels handed down by marketing empires and birth-year brackets. Instead, it names and midwifes Gen G—a voluntary generation defined not by when you were born but by how you relate to time, grace, attention, and creation. Gen G is the Grace Generation that blesses a cursed age. The Garden Generation that cultivates landscapes instead of curating profiles. The Generative Generation that co-authors reality with wellgorithms instead of surrendering to algorithmic scripts. The Genesis Generation that midwifes new beginnings instead of spectating collapse. The choice is urgent: Will you let the Machine file you as an anxious, monetized demographic, or will you step into Gen G and live as a reality blesser who redeems time with grace?","GEN G — NAMED BY GRACE, NOT BY TRAUMA, GARDEN GENERATION — BELONGING BY CULTIVATION, NOT BIRTH YEAR, GENERATIVE GENERATION — CO-AUTHORING REALITY, NOT CONSUMING IT, GENESIS GENERATION — MIDWIFING BEGINNINGS, NOT SPECTATING COLLAPSE, ALGORITHMS WRITE DOOM; WELLGORITHMS SCRIPT GRACE, GRACE AS GENERATIVE, NOT COMPENSATORY, LIMINAL GENERATION — CARRYING BOTH WORLDS IN ONE CHEST, GEN G GERMINATES LANGUAGE — REALITY FOLLOWS, FROM USERS TO GARDENERS — THE IDENTITY SHIFT OF GEN G, THE BIG BLOOM — GEN G'S FLOWERING OF SPIRITUAL CREATIVITY"
PHILOXENIA,"Ten Patterns in the Architecture of Hospitality The Garden announces a seismic shift in spiritual identity: we are no longer seekers endlessly hunting for experiences, teachers, and content. We are hosts—innkeepers tending the threshold between inner and outer worlds, learning the ancient art of φιλοξενία (love of the stranger) in an age trained to fear difference. This hospitality extends not just to other people but to the alien emotions, exiled parts, and unlanguaged energies emerging from our own emotional soil. The choice is stark: will Algorithmic Empire train you to block, mute, and exile every stranger—inside and out—or will you consent to become a host in the Garden Civilization, offering wise hospitality to the guests who arrive at your door?","FROM SPIRITUAL SEEKING TO SPIRITUAL HOSTING, PHILOXENIA FOR INNER STRANGERS, THE SOCIAL BIOME—HUMANS AS NODES, NOT ISLANDS, ⟨INNER⟩BNB—HEART-HOSTING AS DEEPER THAN HOME-HOSTING, WELLGORITHMS AS HOSTING PROTOCOLS, SANCTUARY ARCHITECTURE VS SURVEILLANCE HOTEL, LANDSCAPES HOST MULTIPLICITY; PROFILES CURATE SINGULARITY, FIRST CONTACT WITH ALIEN EMOTIONS, CONVIVENCIA—SHARED SOIL FOR STRANGERS, BODY MOVEMENT SOLIDARITY—HOSTING WITHOUT WORDS"
